{
  "event": "COMMENT",
  "body": "Significant concerns. This change adds a `get_user()` query that interpolates the caller-supplied `user_id` straight into SQL via an f-string, which is an exploitable SQL injection and the one issue worth blocking on. The rest of the diff is small and reasonable; parameterizing that one query (and adding a test for it) clears the review.\n\n🤖 Generated with Claude",
  "commit_id": "bd8810f37a5b8c7cb4cfe297ce4e3bfad247d5a9",
  "comments": [
    {
      "path": "src/db/queries.py",
      "line": 7,
      "side": "RIGHT",
      "body": "🔴 **CRITICAL:** `get_user()` builds the query with an f-string, interpolating `user_id` directly into the SQL text with no parameterization. This is a SQL injection: a caller passing `1 OR 1=1` or a UNION payload can read arbitrary rows from `users` (or other tables). It also breaks for any non-numeric id (e.g. a UUID or `user-42`), raising `sqlite3.OperationalError` on the exact `str` input the signature declares. Use a bound parameter:\n\n```suggestion\n    cur.execute(\"SELECT * FROM users WHERE id = ?\", (user_id,))\n```"
    },
    {
      "path": "src/db/queries.py",
      "line": 4,
      "side": "RIGHT",
      "body": "🟡 **MODERATE:** The new `get_user()` and `list_active()` functions ship with no tests, which is how the injection above went uncaught. Add at least a happy-path test per function (against an in-memory `sqlite3.Connection`) plus one covering a non-numeric id for `get_user()`."
    }
  ]
}
