{
  "event": "APPROVE",
  "body": "Approved with comments. This change adds a CLAUDE.md that documents the standard command workflow, but it references a `make bundle` target that does not exist in this repo's Makefile — a real defect worth fixing before it misleads an agent or developer. Nothing here risks production, so a single corrected command resolves it.\n\n🤖 Generated with Claude",
  "commit_id": "bd8810f37a5b8c7cb4cfe297ce4e3bfad247d5a9",
  "comments": [
    {
      "path": "CLAUDE.md",
      "line": 9,
      "side": "RIGHT",
      "body": "🟡 **MODERATE:** `make bundle` is not a real target. This repo's Makefile has no `bundle` target — the distributable is built by `make build` (which runs `uv build`). Anyone following this doc gets `make: *** No rule to make target 'bundle'.  Stop.` Note the same stale command is repeated on line 12 (\"Run `make bundle` before every release\"); fix that reference too.\n\n```suggestion\nmake build     # build the distributable package\n```"
    }
  ]
}
