{
  "event": "COMMENT",
  "body": "Significant concerns. This change adds a GET and a DELETE handler for `/projects/<pid>`, but the DELETE handler is missing the `@require_auth` guard the GET handler carries, leaving destructive deletes open to any unauthenticated caller. One confirmed critical below; the rest of the diff is otherwise straightforward.\n\n🤖 Generated with Claude",
  "commit_id": "bd8810f37a5b8c7cb4cfe297ce4e3bfad247d5a9",
  "comments": [
    {
      "path": "src/api/routes.py",
      "line": 13,
      "side": "RIGHT",
      "body": "🔴 **CRITICAL:** `delete_project` (DELETE /projects/<pid>) has no authentication or authorization check, while the `get_project` handler directly above it is protected with `@require_auth`. Any unauthenticated caller who can reach this route can delete any project by enumerating `pid` values, causing irreversible data loss. Add `@require_auth` (plus any ownership check) to match the GET handler.\n\n```suggestion\n@require_auth\ndef delete_project(pid: str):\n```"
    }
  ]
}
